{
  "$schema": "http://json-schema.org/draft-07/schema#",
  "title": "PluginJsonManifest",
  "description": "Parsed and validated `plugin.json` manifest.\n\nThis is the public plugin contract used by the plugin registry and PDK. Every plugin distributed via the Cascade plugin ecosystem must include a `plugin.json` file at the root of its plugin directory.",
  "type": "object",
  "required": [
    "author",
    "description",
    "entry_wasm",
    "id",
    "kind",
    "license",
    "min_cascade_version",
    "name",
    "version"
  ],
  "properties": {
    "author": {
      "description": "Plugin author (name or email).",
      "type": "string"
    },
    "capabilities": {
      "description": "List of capability tokens this plugin declares (subset of allowed vocabulary).\n\nAllowed tokens: `\"fs_read\"`, `\"fs_write\"`, `\"net_outbound\"`, `\"env_read\"`.",
      "default": [],
      "type": "array",
      "items": {
        "type": "string"
      }
    },
    "description": {
      "description": "One-line description shown in the plugin browser.",
      "type": "string"
    },
    "entry_wasm": {
      "description": "Relative path from the plugin directory to the compiled WASM entry-point (e.g. `\"plugin.wasm\"`). Must not be an absolute path.",
      "type": "string"
    },
    "exports": {
      "description": "Exported WASM function names this plugin exposes (e.g. `[\"run\", \"describe\"]`).",
      "default": [],
      "type": "array",
      "items": {
        "type": "string"
      }
    },
    "id": {
      "description": "Reverse-domain plugin identifier (e.g. `\"com.example.my-plugin\"`).\n\nMust match `^[a-z][a-z0-9_-]*(\\.[a-z][a-z0-9_-]*)+$`.",
      "type": "string"
    },
    "kind": {
      "description": "Plugin kind — determines the ABI surface and sandbox resource limits.",
      "allOf": [
        {
          "$ref": "#/definitions/PluginKind"
        }
      ]
    },
    "license": {
      "description": "SPDX license identifier (e.g. `\"MIT\"`, `\"Apache-2.0\"`).",
      "type": "string"
    },
    "min_cascade_version": {
      "description": "Minimum Cascade version required to run this plugin (semver requirement, e.g. `\">=0.2.0\"`).",
      "type": "string"
    },
    "name": {
      "description": "Human-readable display name.",
      "type": "string"
    },
    "permissions": {
      "description": "Permissions required by this plugin (DENY-by-default; empty = none).",
      "default": {
        "env": [],
        "fs": [],
        "net": []
      },
      "allOf": [
        {
          "$ref": "#/definitions/JsonPermissions"
        }
      ]
    },
    "version": {
      "description": "Plugin version — must be a valid semver string (e.g. `\"1.2.3\"`).",
      "type": "string"
    }
  },
  "definitions": {
    "EnvPermission": {
      "description": "Environment-variable permission scope.",
      "type": "object",
      "required": [
        "name"
      ],
      "properties": {
        "name": {
          "description": "Variable name the plugin may read (e.g. `\"HOME\"`).",
          "type": "string"
        }
      }
    },
    "FsPermission": {
      "description": "Filesystem permission scope.\n\n`path` must be a relative path or an explicit token such as `\"$HOME\"`. Absolute paths are rejected to prevent manifest authors from escaping the plugin sandbox by declaring `/etc` as a read scope.",
      "type": "object",
      "required": [
        "path"
      ],
      "properties": {
        "path": {
          "description": "Relative path scope (e.g. `\"data/\"` or `\"$HOME/.config/cascade\"`).",
          "type": "string"
        },
        "read": {
          "description": "Allow reading files inside `path`.",
          "default": false,
          "type": "boolean"
        },
        "write": {
          "description": "Allow writing files inside `path`.",
          "default": false,
          "type": "boolean"
        }
      }
    },
    "JsonPermissions": {
      "description": "Aggregated permissions declared in `plugin.json`.\n\nAll fields default to empty — DENY-by-default unless explicitly listed.",
      "type": "object",
      "properties": {
        "env": {
          "default": [],
          "type": "array",
          "items": {
            "$ref": "#/definitions/EnvPermission"
          }
        },
        "fs": {
          "default": [],
          "type": "array",
          "items": {
            "$ref": "#/definitions/FsPermission"
          }
        },
        "net": {
          "default": [],
          "type": "array",
          "items": {
            "$ref": "#/definitions/NetPermission"
          }
        }
      }
    },
    "NetPermission": {
      "description": "Network permission scope.\n\nDeclare each host the plugin may reach. Wildcards (`\"*\"`) are rejected.",
      "type": "object",
      "required": [
        "host"
      ],
      "properties": {
        "host": {
          "description": "Allowed host (e.g. `\"api.example.com\"`). Wildcards are denied.",
          "type": "string"
        },
        "ports": {
          "description": "Allowed ports (e.g. `[443, 8080]`). Empty list means all ports.",
          "default": [],
          "type": "array",
          "items": {
            "type": "integer",
            "format": "uint16",
            "minimum": 0.0
          }
        }
      }
    },
    "PluginKind": {
      "description": "Plugin kind variants for `plugin.json`.\n\nDefines the contract surface and sandbox resource profile.",
      "type": "string",
      "enum": [
        "DataSource",
        "ChatTool",
        "Widget",
        "Provider",
        "Agent"
      ]
    }
  }
}